{
  "acceptance_signals": [
    "The first-screen route block still contains exactly three primary links.",
    "The Governed example route points directly to the published governed-refund-walkthrough.html GitHub Pages URL rather than the internal #governed-example anchor.",
    "Quickstart and Architecture retain their existing destinations.",
    "The README body retains its local Governed example section and repository-relative walkthrough link as supporting content.",
    "Documentation tests protect the exact three-route contract and the live demo destination.",
    "STATUS and the dated log record the correction, validation, remaining human-comprehension unknown, and no broader Git or publication authority."
  ],
  "contract": "agentgov.development-task",
  "decision": {
    "decided_by": "Human product owner",
    "rationale": "The accountable human reviewed structured proposal prp-bcf6cf09c7e743a688350769b5686336 and admitted that exact task through an explicit admission control.",
    "state": "admitted"
  },
  "owner": "Human product owner",
  "profile": "compact",
  "requirement": {
    "source_refs": [],
    "summary": "Keep exactly three primary first-screen README routes while changing the Governed example route from the internal README anchor to the published governed refund walkthrough page so a reader can open the live demo directly."
  },
  "risk": {
    "items": [
      "Adding a fourth first-screen link would violate the product-entry acceptance contract.",
      "Using a repository-relative HTML path in the top route would open GitHub source rather than the published interactive page.",
      "Changing the published HTML page or assets would expand this correction beyond README navigation.",
      "The pre-existing user-owned .codex path remains excluded and may remain visible to the deterministic scope checker.",
      "Reviewed assumption: The published governed refund walkthrough remains available at the documented GitHub Pages URL.",
      "Reviewed assumption: The product owner's instruction means to restore direct first-screen access to that live demo while preserving the three-route limit.",
      "Reviewed unknown: Unbriefed-reader comprehension remains untested and is not established by restoring the link."
    ],
    "level": "low"
  },
  "schema_version": "1.1",
  "scope": {
    "exclude_paths": [
      ".codex",
      "DEVELOPMENT_PLAN.md",
      "docs/index.html",
      "docs/governed-refund-walkthrough.html",
      "docs/assets",
      "tests/test_portfolio_page.py",
      "src",
      "schemas",
      "release"
    ],
    "include_paths": [
      "README.md",
      "STATUS.md",
      "docs/development-log/2026-08-21.md",
      "governance/tasks/p1-restore-readme-live-demo-route-v1.json",
      "tests/test_user_documentation.py"
    ]
  },
  "task_id": "p1-restore-readme-live-demo-route-v1",
  "title": "Restore the README live demo route",
  "validation_commands": [
    "$env:PYTHONPATH = \"src\"; python -m unittest tests.test_user_documentation tests.test_portfolio_page tests.test_status -v",
    "$env:PYTHONPATH = \"src\"; python -m unittest discover -s tests -v",
    "$env:PYTHONPATH = \"src\"; python -m agentgov check task governance/tasks/p1-restore-readme-live-demo-route-v1.json --repository .",
    "$env:PYTHONPATH = \"src\"; python -m agentgov check repository .",
    "$env:PYTHONPATH = \"src\"; python -m agentgov check scope governance/tasks/p1-restore-readme-live-demo-route-v1.json --repository . --format terminal",
    "git diff --check"
  ]
}
