{
  "acceptance_signals": [
    "Paused v1 remains paused and records that final audit found the ignored bytecode side effect.",
    "The test loader suppresses bytecode only around dynamic import and restores the process setting afterward.",
    "Loading and running the demo tests creates no __pycache__ beneath examples/governed-refund-demo.",
    "Only the generated examples/governed-refund-demo/__pycache__ directory from the current test run is removed; no user-owned or unrelated file is deleted.",
    "The existing five Demo semantics remain unchanged and pass.",
    "The 73 related tests and complete repository suite pass.",
    "Task and repository governance have no deterministic contract failure; admitted scope inspection accepts the five v2-owned paths and deliberately rejects the preserved v1 runner and README plus untouched .codex configuration.",
    "STATUS and the dated log record the v1 fail-closed correction and final v2 evidence.",
    "No runner, README, Landing, Kernel, schema, release, integration, Git, publication, or hosting behavior changes."
  ],
  "contract": "agentgov.development-task",
  "decision": {
    "decided_by": "Human product owner",
    "rationale": "The accountable human reviewed structured proposal prp-aaaa62bf64c0426ea64dceb8c673dc1f and admitted that exact task through an explicit admission control. Final audit verified that the only generated example cache contained the dynamic-import bytecode and removed that exact directory. The test loader now suppresses bytecode only around module execution, restores the prior process setting in a finally block, and asserts that the example cache remains absent. The existing 5 Demo tests, 73 related tests, and complete 931-test repository suite pass with 3 platform-limited skips; the cache is absent after validation. While admitted, task governance reported PASS=3 WARN=1 FAIL=0 ADVISORY=3 and repository governance reported PASS=26 WARN=2 FAIL=0 ADVISORY=4. Scope accepted all five v2-owned paths and rejected only the deliberately excluded, preserved v1 runner and README plus untouched .codex configuration; no exception was inferred. Demo semantics, runner, README, Landing, Kernel, schemas, release identity, Git state, and publication behavior were unchanged. The task is paused for product-owner review.",
    "state": "paused"
  },
  "owner": "Human product owner",
  "profile": "compact",
  "requirement": {
    "source_refs": [],
    "summary": "Replace paused M1 task v1 after final audit found that the test loader writes ignored Python bytecode into the example directory. Preserve the completed Demo behavior, prevent dynamic test import from writing bytecode in the source worktree, remove only the generated example cache, update closeout evidence, and revalidate without changing product semantics."
  },
  "risk": {
    "items": [
      "Global bytecode suppression could leak to other tests if not restored.",
      "Cleanup could target more than the exact generated cache directory.",
      "The isolation assertion could depend on stale preexisting cache state.",
      "Reviewed assumption: The cache directory was generated by the current dynamic import test and contains only Python bytecode.",
      "Reviewed assumption: Python sys.dont_write_bytecode is sufficient to prevent importlib from creating the example cache.",
      "Reviewed assumption: The M1 runner and README behavior already satisfy the admitted product semantics."
    ],
    "level": "low"
  },
  "schema_version": "1.1",
  "scope": {
    "exclude_paths": [
      ".codex",
      "docs/index.html",
      "examples/governed-refund-demo/run_demo.py",
      "examples/governed-refund-demo/README.md",
      "src/agentgov",
      "governance/schemas",
      "governance/contracts",
      "README.md",
      ".github"
    ],
    "include_paths": [
      "tests/test_governed_task_demo.py",
      "STATUS.md",
      "docs/development-log/2026-08-18.md",
      "governance/tasks/p0-governed-task-demo-fixture-v1.json",
      "governance/tasks/p0-governed-task-demo-fixture-v2.json"
    ]
  },
  "task_id": "p0-governed-task-demo-fixture-v2",
  "title": "Correct governed refund demo isolation",
  "validation_commands": [
    "$env:PYTHONPATH='src'; python -m unittest tests.test_governed_task_demo -v",
    "$env:PYTHONPATH='src'; python -m unittest tests.test_governed_task_demo tests.test_change_scope tests.test_foreground_coordinator tests.test_coding_agent_transport tests.test_development_evidence tests.test_host_interaction tests.test_human_decision -v",
    "$env:PYTHONPATH='src'; python -m unittest discover -s tests -v",
    "$env:PYTHONPATH='src'; python -m agentgov check task governance/tasks/p0-governed-task-demo-fixture-v2.json --repository .",
    "$env:PYTHONPATH='src'; python -m agentgov check repository .",
    "$env:PYTHONPATH='src'; python -m agentgov check scope governance/tasks/p0-governed-task-demo-fixture-v2.json --repository .",
    "Verify examples/governed-refund-demo/__pycache__ does not exist after tests.",
    "git diff --check",
    "git status -sb"
  ]
}
